{
  "schemaVersion": 1,
  "engineRulesVersion": 1,
  "id": "w3-02",
  "revision": 1,
  "worldId": "w3",
  "ordinal": 2,
  "titleKey": "level.w3-02.title",
  "board": {
    "width": 4,
    "height": 3,
    "tiles": [
      {
        "x": 0,
        "y": 2
      },
      {
        "x": 1,
        "y": 2
      },
      {
        "x": 0,
        "y": 1
      },
      {
        "x": 0,
        "y": 0
      },
      {
        "x": 1,
        "y": 0
      },
      {
        "x": 2,
        "y": 0
      },
      {
        "x": 2,
        "y": 1
      },
      {
        "x": 3,
        "y": 1
      },
      {
        "x": 3,
        "y": 0
      }
    ],
    "walls": []
  },
  "start": {
    "x": 0,
    "y": 2,
    "facing": "N"
  },
  "goal": {
    "x": 3,
    "y": 0
  },
  "collectibles": [
    {
      "id": "item-1",
      "x": 2,
      "y": 0,
      "kind": "required"
    }
  ],
  "gates": [
    {
      "id": "gate-a",
      "x": 1,
      "y": 0
    },
    {
      "id": "gate-b",
      "x": 3,
      "y": 1
    }
  ],
  "switches": [
    {
      "id": "switch-a",
      "x": 0,
      "y": 1,
      "opens": [
        "gate-a"
      ]
    },
    {
      "id": "switch-b",
      "x": 2,
      "y": 0,
      "opens": [
        "gate-b"
      ]
    }
  ],
  "commands": [
    "forward",
    "left",
    "right",
    "repeat"
  ],
  "limits": {
    "maxBlocks": 14,
    "maxActions": 24
  },
  "rating": {
    "parBlocks": 11
  },
  "teaching": {
    "concept": "switch-order",
    "archetype": "two-gate-route",
    "difficulty": 1
  },
  "hintKeys": [
    "level.w3-02.hint.1",
    "level.w3-02.hint.2",
    "level.w3-02.hint.3"
  ]
}
