{
  "schemaVersion": 1,
  "engineRulesVersion": 1,
  "id": "w1-03",
  "revision": 1,
  "worldId": "w1",
  "ordinal": 3,
  "titleKey": "level.w1-03.title",
  "board": {
    "width": 3,
    "height": 3,
    "tiles": [
      {
        "x": 0,
        "y": 2
      },
      {
        "x": 1,
        "y": 2
      },
      {
        "x": 1,
        "y": 1
      },
      {
        "x": 1,
        "y": 0
      },
      {
        "x": 2,
        "y": 0
      }
    ],
    "walls": []
  },
  "start": {
    "x": 0,
    "y": 2,
    "facing": "E"
  },
  "goal": {
    "x": 2,
    "y": 0
  },
  "collectibles": [],
  "gates": [],
  "switches": [],
  "commands": [
    "forward",
    "left",
    "right"
  ],
  "limits": {
    "maxBlocks": 8,
    "maxActions": 12
  },
  "rating": {
    "parBlocks": 6
  },
  "teaching": {
    "concept": "left-turn",
    "archetype": "offset-elbow",
    "difficulty": 1
  },
  "hintKeys": [
    "level.w1-03.hint.1",
    "level.w1-03.hint.2",
    "level.w1-03.hint.3"
  ]
}
