{
  "schemaVersion": 1,
  "engineRulesVersion": 1,
  "id": "w1-08",
  "revision": 1,
  "worldId": "w1",
  "ordinal": 8,
  "titleKey": "level.w1-08.title",
  "board": {
    "width": 4,
    "height": 3,
    "tiles": [
      {
        "x": 0,
        "y": 0
      },
      {
        "x": 1,
        "y": 0
      },
      {
        "x": 2,
        "y": 0
      },
      {
        "x": 3,
        "y": 0
      },
      {
        "x": 0,
        "y": 1
      },
      {
        "x": 1,
        "y": 1
      },
      {
        "x": 2,
        "y": 1
      },
      {
        "x": 3,
        "y": 1
      },
      {
        "x": 0,
        "y": 2
      },
      {
        "x": 1,
        "y": 2
      },
      {
        "x": 2,
        "y": 2
      },
      {
        "x": 3,
        "y": 2
      }
    ],
    "walls": [
      {
        "x": 2,
        "y": 1
      }
    ]
  },
  "start": {
    "x": 0,
    "y": 2,
    "facing": "E"
  },
  "goal": {
    "x": 3,
    "y": 0
  },
  "collectibles": [
    {
      "id": "item-1",
      "x": 1,
      "y": 2,
      "kind": "required"
    },
    {
      "id": "item-2",
      "x": 1,
      "y": 0,
      "kind": "required"
    }
  ],
  "gates": [],
  "switches": [],
  "commands": [
    "forward",
    "left",
    "right"
  ],
  "limits": {
    "maxBlocks": 9,
    "maxActions": 16
  },
  "rating": {
    "parBlocks": 7
  },
  "teaching": {
    "concept": "pickup-order",
    "archetype": "two-pickup-corridor",
    "difficulty": 2
  },
  "hintKeys": [
    "level.w1-08.hint.1",
    "level.w1-08.hint.2",
    "level.w1-08.hint.3"
  ]
}
